游戏地址,游戏名字,评分,评论1,评论2,游戏类型
http://www.4399.com/flash/238772.htm,掉落的水珠,5,游戏体验非常棒，五星好评！,操作很简单，但很有趣。,体育类
http://www.4399.com/flash/97275.htm,3D旋转麻将连连看,5,游戏设计很精巧，细节处理得很好。,游戏操作非常顺滑，体验极佳。,体育类
http://www.4399.com/flash/157666.htm,史上最贱小游戏13,5,每次更新都有新的玩法，很有趣。,每次更新都有新内容，很期待。,体育类
http://www.4399.com/flash/117146.htm,火柴人智闯飞艇,5,每个关卡都很有挑战性。,每次玩都有不同的感受，很新鲜。,体育类
http://www.4399.com/flash/239255.htm,3D俄罗斯方块消除,5,每次玩都能发现新的惊喜。,每次玩都有不同的体验，很有趣。,体育类
http://www.4399.com/flash/239115.htm,隐秘的档案3,5,游戏内容很丰富，不会觉得无聊。,每次玩都有不同的感受，很新鲜。,体育类
http://www.4399.com/flash/96689.htm,愤怒的小鸟太空版HD,5,任务系统很完善，玩起来很有动力。,游戏操作非常顺滑，体验极佳。,体育类
http://www.4399.com/flash/53510.htm,红楼梦连连看,5,强烈推荐给朋友们一起玩！,游戏内容很丰富，玩法很多样。,体育类
http://www.4399.com/flash/236426.htm,燃烧吧大脑,5,游戏内购合理，不影响体验。,非常好玩，推荐给大家！,体育类
http://www.4399.com/flash/234972.htm,非常调查局魂器,5,游戏设计的细节非常到位。,关卡设计巧妙，令人耳目一新。,体育类
