游戏地址,游戏名字,评分,评论1,评论2,游戏类型
http://www.4399.com/flash/128952.htm,坏蛋冰淇淋3,5,奖励系统丰富，很有动力玩下去。,游戏设计的细节非常到位。,冒险类
http://www.4399.com/flash/143093.htm,果蔬连连看HD,5,画风很治愈，玩起来很放松。,每次更新都有新的玩法，很有趣。,冒险类
http://www.4399.com/flash/238527.htm,贪吃鱼进化,5,界面设计很漂亮，游戏性很强。,挑战性很强，每关都很有趣。,冒险类
http://www.4399.com/flash/102581.htm,帮鸟儿解冻,5,操作简单，但需要动脑，很有趣。,画质很好，游戏体验很棒。,冒险类
http://www.4399.com/flash/235840.htm,疯狂小女孩,5,游戏机制很独特，玩法很新颖。,游戏节奏很好，不会觉得拖沓。,冒险类
http://www.4399.com/flash/41285.htm,朵拉的迷你高尔夫,5,游戏设计很精巧，细节处理得很好。,画风独特，非常有艺术感。,冒险类
http://www.4399.com/flash/42075.htm,光头小子找出口,5,任务系统很完善，玩起来很有动力。,每个关卡都很有挑战性。,冒险类
http://www.4399.com/flash/50909.htm,植物战僵尸3D连连看,5,游戏设计很有创意，值得一试。,每次挑战都有新收获，很有成就感。,冒险类
http://www.4399.com/flash/41483.htm,装载卡车,5,画质很好，游戏体验很棒。,社交功能完善，可以和朋友一起玩。,冒险类
http://www.4399.com/flash/113377.htm,森林冰火人4无敌版,5,任务系统很完善，玩起来很有动力。,每次挑战都有新收获，很有成就感。,冒险类
